A1: ::: 政府委辦補助 中央政府歷年對國民黨黨營事業委辦及補助經費統計表(2007/3) 張貼日期：2007/3/8 使用 IE 6.0 以上 最佳觀看解析度 1024x768 ． 網站免責條款 國家資產經營管理委員會—黨產處理小組 本網站所載之新聞報導、學者研究等內容，其著作權屬各該著作權人所有，其內容不代表政府立場。其餘資料，依政府資料開放授權條款釋出。本網站原始碼，依MIT授權條款釋出。 歡迎連結

A1: 中央政府歷年對國民黨黨營事業委辦及補助經費統計表
D2: 單位：千元
A3: 黨營事業 | B3: 合計 | C3: 委辦 | D3: 補助
A4: 合計 | B4: =SUM(B5:B12) -> 9280650 | C4: =SUM(C5:C12) -> 3279918 | D4: =SUM(D5:D12) -> 6000732
A5: 中國廣播公司 | B5: =SUM(C5:D5) -> 7324166 | C5: 2258435 | D5: 5065731
A6: 中央日報社 | B6: =SUM(C6:D6) -> 1358256 | C6: 617490 | D6: 740766
A7: 中國電視公司 | B7: =SUM(C7:D7) -> 377305 | C7: 372559 | D7: 4746
A8: 中央電影公司 | B8: =SUM(C8:D8) -> 118545 | C8: 641 | D8: 117904
A9: 東京自由新聞社 | B9: =SUM(C9:D9) -> 69378 | C9: 0 | D9: 69378
A10: 中華文化事業股份有限公司 | B10: =SUM(C10:D10) -> 24293 | C10: 24293 | D10: 0
A11: 中華日報社 | B11: =SUM(C11:D11) -> 7507 | C11: 5900 | D11: 1607
A12: 中央月刋社 | B12: =SUM(C12:D12) -> 1200 | C12: 600 | D12: 600
A13: 資料來源：中央政府各機關