A1: ::: 政府委辦補助 中央政府歷年對國民黨相關附隨組織委辦及補助經費統計表(2007/3) 張貼日期：2007/3/8 使用 IE 6.0 以上 最佳觀看解析度 1024x768 ． 網站免責條款 國家資產經營管理委員會—黨產處理小組 本網站所載之新聞報導、學者研究等內容，其著作權屬各該著作權人所有，其內容不代表政府立場。其餘資料，依政府資料開放授權條款釋出。本網站原始碼，依MIT授權條款釋出。 歡迎連結

A1: 中央政府歷年對國民黨附隨或相關組織委辦及補助經費統計表
D2: 單位：千元
A3: 附隨組織 | B3: 合計 | C3: 委辦 | D3: 補助
A4: 合計 | B4: =SUM(B5:B12) -> 8869542 | C4: =SUM(C5:C12) -> 1771070 | D4: =SUM(D5:D12) -> 7098472
A5: 中華救助總會 | B5: =SUM(C5:D5) -> 3676598 | C5: 614 | D5: =1007874+1764440+903670 -> 3675984
A6: 中國青年救國團 | B6: =SUM(C6:D6) -> 2722990 | C6: 1767149 | D6: 955841
A7: 世亞盟 | B7: =SUM(C7:D7) -> 2345522 | D7: 2345522
A8: 婦女聯合會 | B8: =SUM(C8:D8) -> 65967 | C8: 1500 | D8: 64467
A9: 海工會 | B9: =SUM(C9:D9) -> 21551 | C9: 0 | D9: 21551
A10: 大陸問題研究中心 | B10: =SUM(C10:D10) -> 18332 | C10: 0 | D10: 18332
A11: 三民主義統一中國大同盟 | B11: =SUM(C11:D11) -> 10110 | D11: 10110
A12: 其他（註） | B12: =SUM(C12:D12) -> 8472 | C12: 1807 | D12: =3293+1940+1393+39 -> 6665
A13: 註：其他一項包含表揚好人好事運動協會、民眾服務總社、中國青年服務社、中山學會及海外之國父紀念館。
A14: 資料來源：中央政府各機關