A1: ::: 政府委辦補助 （按機關）中央政府歷年對國民黨黨營事業、相關附隨組織委辦及補助經費統計表(2007/3) 張貼日期：2007/3/8 使用 IE 6.0 以上 最佳觀看解析度 1024x768 ． 網站免責條款 國家資產經營管理委員會—黨產處理小組 本網站所載之新聞報導、學者研究等內容，其著作權屬各該著作權人所有，其內容不代表政府立場。其餘資料，依政府資料開放授權條款釋出。本網站原始碼，依MIT授權條款釋出。 歡迎連結

A1: 中央政府歷年對國民黨黨營事業、附隨或相關組織委辦及補助經費統計表（按機關別）
D2: 單位：千元
A3: 機關 | B3: 合計 | C3: 委辦 | D3: 補助
A4: 合計 | B4: =SUM(B5:B18) -> 18150192 | C4: =SUM(C5:C18) -> 5050988 | D4: =SUM(D5:D18) -> 13099204
A5: 內政部 | B5: =SUM(C5:D5) -> 3994621 | D5: 3994621
A6: 外交部 | B6: =SUM(C6:D6) -> 2388343 | D6: 2388343
A7: 教育部 | B7: =SUM(C7:D7) -> 1933199 | C7: 685447 | D7: =1244152+3600 -> 1247752
A8: 經濟部 | B8: =SUM(C8:D8) -> 3567 | C8: 1013 | D8: 2554
A9: 交通部 | B9: =SUM(C9:D9) -> 1368031 | D9: =1271709+96322 -> 1368031
A10: 蒙藏委員會 | B10: =SUM(C10:D10) -> 37478 | C10: 2421 | D10: 35057
A11: 僑務委員會 | B11: =SUM(C11:D11) -> 2360387 | C11: 2097063 | D11: 263324
A12: 行政院勞工委員會 | B12: =SUM(C12:D12) -> 5292 | C12: 4667 | D12: 625
A13: 行政院新聞局 | B13: =SUM(C13:D13) -> 5828932 | C13: 2229154 | D13: 3599778
A14: 行政院文化建設委員會 | B14: =SUM(C14:D14) -> 61131 | C14: 31223 | D14: 29908
A15: 行政院青年輔導委員會 | B15: =SUM(C15:D15) -> 43480 | D15: 43480
A16: 行政院大陸委員會 | B16: =SUM(C16:D16) -> 875 | D16: 875
A17: 中央銀行 | B17: =SUM(C17:D17) -> 250 | D17: 250
A18: 統籌科目(註) | B18: =SUM(C18:D18) -> 124606 | D18: 124606
A19: 註：表列「統籌科目」係早期總預算編列科目分類之一，其非歸屬於各機關預算，內容包括宣傳補助費、對婦女聯合會等人民團體補助費等。
A20: 資料來源：中央政府各機關