A1: ::: 政府委辦補助 （按年代）中央政府歷年對國民黨黨營事業、相關附隨組織委辦及補助經費統計表(2007/3) 張貼日期：2007/3/8 使用 IE 6.0 以上 最佳觀看解析度 1024x768 ． 網站免責條款 國家資產經營管理委員會—黨產處理小組 本網站所載之新聞報導、學者研究等內容，其著作權屬各該著作權人所有，其內容不代表政府立場。其餘資料，依政府資料開放授權條款釋出。本網站原始碼，依MIT授權條款釋出。 歡迎連結

A1: 中央政府歷年對國民黨黨營事業、附隨或相關組織委辦及補助經費統計表（按年代別）
D2: 單位：千元
A3: 年度 | B3: 合計 | C3: 委辦 | D3: 補助
A4: 合計 | B4: =SUM(B5:B10) -> 18150192 | C4: =SUM(C5:C10) -> 5050988 | D4: =SUM(D5:D10) -> 13099204
A5: 39-49 | B5: =SUM(C5:D5) -> 93582 | C5: 23248 | D5: 70334
A6: 50-59 | B6: =SUM(C6:D6) -> 471398 | C6: 17330 | D6: 454068
A7: 60-69 | B7: =SUM(C7:D7) -> 2378932 | C7: 124213 | D7: 2254719
A8: 70-79 | B8: =SUM(C8:D8) -> 7585012 | C8: 855139 | D8: 6729873
A9: 80-89 | B9: =SUM(C9:D9) -> 7149190 | C9: 3712957 | D9: 3436233
A10: 90-95 | B10: =SUM(C10:D10) -> 472078 | C10: 318101 | D10: 153977
A11: 資料來源：中央政府各機關